Data;Liga;Jogo;Mercado;Odd;Stake€;Edge%;Apostada;OddReal;StakeReal€;Resultado;Lucro€;LucroReal€;KickoffUTC
2026-06-20;MLS;Minnesota United II vs St. Louis City II;O2.5;1.58;0.34;3.75;;;;;;;2026-06-20T21:00:00+01:00
2026-06-21;MLS;Colorado Rapids II vs Portland Timbers II;O2.5;1.58;0.34;3.75;;;;;;;2026-06-21T01:00:00+01:00
2026-06-21;MLS;New England II vs Chicago Fire II;O2.5;1.58;0.34;3.75;;;;;;;2026-06-21T16:00:00+01:00
2026-06-21;MLS;Huntsville City vs Crown Legacy;O2.5;1.55;0.16;2.52;;;;;;;2026-06-21T01:00:00+01:00
2026-06-23;Veikkausliiga;KuPS vs Ilves;O2.5;1.73;2.0;13.3;;;;;;;2026-06-23T16:00:00+01:00
2026-06-23;Veikkausliiga;Lahti vs Turku PS;O2.5;1.99;1.74;9.81;;;;;;;2026-06-23T16:00:00+01:00
2026-06-23;Veikkausliiga;Inter Turku vs SJK;O2.5;1.7;0.13;2.44;;;;;;;2026-06-23T17:00:00+01:00
